;ENGLISH;GERMAN;POLISH;RUSSIAN;FRENCH;SPANISH;BRASILIAN;CHINESE_SP;JAPANESE;KOREAN
gui/hud/building_description/alloys_factory;Produces alloys from cobalt and molten iron;;;;;;;;;
gui/hud/building_description/alloys_factory_palladium;Produces alloys from palladium and molten iron;;;;;;;;;
gui/hud/building_description/alloys_factory_titanium;Produces alloys from titanium and molten iron;;;;;;;;;
gui/hud/building_description/alloys_factory_uranium;Produces alloys from deplated uranium and molten iron;;;;;;;;;
gui/hud/building_description/ammo_factory_energy_adv;Upgrades energy ammunitions to advanced standard;;;;;;;;;
gui/hud/building_description/ammo_factory_energy_ext;Upgrades energy ammunitions to top end standard;;;;;;;;;
gui/hud/building_description/ammo_factory_explosive_adv;Upgrades explosive ammunitions to advanced standard;;;;;;;;;
gui/hud/building_description/ammo_factory_explosive_ext;Upgrades explosive ammunitions to top end standard;;;;;;;;;
gui/hud/building_description/ammo_factory_explosive_liquid;Produces basic explosives and liquid ammunitions;;;;;;;;;
gui/hud/building_description/ammo_factory_highcaliber_adv;Upgrades high caliber ammunitions to advanced standard;;;;;;;;;
gui/hud/building_description/ammo_factory_highcaliber_adv_molt;Produces advanced high caliber ammunitions;;;;;;;;;
gui/hud/building_description/ammo_factory_highcaliber_adv_molt_uranium;Produces advanced depleted uranium high caliber ammunitions;;;;;;;;;
gui/hud/building_description/ammo_factory_highcaliber_adv_uranium;Upgrades high caliber ammunitions to with depleted uranium to advanced standard;;;;;;;;;
gui/hud/building_description/ammo_factory_highcaliber_adv_uranium_molt;Produces advanced depleted uranium high caliber ammunitions;;;;;;;;;
gui/hud/building_description/ammo_factory_highcaliber_ext;Upgrades caliber ammunitions  to top end standard;;;;;;;;;
gui/hud/building_description/ammo_factory_highcaliber_ext_molt;Upgrades high caliber ammunitions to top end standard;;;;;;;;;
gui/hud/building_description/ammo_factory_liquid_adv;Upgrades liquid ammunitions via carbonium and ferdonite as a key component to advanced standard;;;;;;;;;
gui/hud/building_description/ammo_factory_liquid_adv_gas;Upgrades liquid ammunitions via natural gas and ferdonite as a key component to advanced standard;;;;;;;;;
gui/hud/building_description/ammo_factory_liquid_ext;Upgrades liquid ammunitions to top end standard;;;;;;;;;
gui/hud/building_description/ammo_factory_lowcaliber_adv;Upgrades low caliber ammunitions to advanced standard;;;;;;;;;
gui/hud/building_description/ammo_factory_lowcaliber_adv_molt;Produces advanced low caliber ammunitions;;;;;;;;;
gui/hud/building_description/ammo_factory_lowcaliber_adv_molt_uranium;Produces advanced depleted uranium low caliber ammunitions;;;;;;;;;
gui/hud/building_description/ammo_factory_lowcaliber_adv_uranium;Upgrades low caliber ammunitions to with depleted uranium to advanced standard;;;;;;;;;
gui/hud/building_description/ammo_factory_lowcaliber_adv_uranium_molt;Produces advanced depleted uranium low caliber ammunitions;;;;;;;;;
gui/hud/building_description/ammo_factory_lowcaliber_ext;Upgrades low caliber ammunitions to top end standard;;;;;;;;;
gui/hud/building_description/ammo_factory_lowcaliber_ext_molt;Upgrades low caliber ammunitions to top end standard;;;;;;;;;
gui/hud/building_description/ammo_factory_lowcaliber_highcaliber;Produces basic low and ligh caliber ammunitions;;;;;;;;;
gui/hud/building_description/ammo_storage_energy;Stores portable energy cells for mech weapons;;;;;;;;;
gui/hud/building_description/ammo_storage_explosive;Stores explosive ammunition;;;;;;;;;
gui/hud/building_description/ammo_storage_highcaliber;Stores large caliber ammunition;;;;;;;;;
gui/hud/building_description/ammo_storage_liquid;Stores liquid ammunition;;;;;;;;;
gui/hud/building_description/ammo_storage_lowcaliber;Stores low caliber ammunition;;;;;;;;;
gui/hud/building_description/ammonium_extractor;Extracts ammonium from nitic acid;;;;;;;;;
gui/hud/building_description/ammonium_synthesizer;Synthesizes ammonium from atmospheric nitrogen via the Haber-process. Flammable gas serves serves as hydrogen source.;;;;;;;;;
gui/hud/building_description/ammonium_synthesizer_lvl_2;Improves the Haber process by cleaning the gas from sulfur residuals using water;;;;;;;;;
gui/hud/building_description/bio_cobalt_refinery;Refines cobalt from bio-compounds and reagent fluid;;;;;;;;;
gui/hud/building_description/bio_palladium_refinery;Refines palladium from bio-composites and plasma;;;;;;;;;
gui/hud/building_description/bio_titanium_refinery;Refines titanium from bio-compounds and reagent fluid;;;;;;;;;
gui/hud/building_description/bio_uranium_ore_refinery;Refines uranium ore from bio-compounds and nitric acid;;;;;;;;;
gui/hud/building_description/biomass_morphed_press;Extracts morphium from morphed biomass;;;;;;;;;
gui/hud/building_description/biomass_mycelium_press;Extracts fluorine from fluor rich mycelium;;;;;;;;;
gui/hud/building_description/biomass_oil_press;Extracts petroleum from biooil ritch biomass;;;;;;;;;
gui/hud/building_description/biomass_plant_press;Extracts sludge from plant biomass;;;;;;;;;
gui/hud/building_description/biomass_water_press;Extracts sludge from biooil;;;;;;;;;
gui/hud/building_description/bioreactor;Uses biological processes to decompose mud into sludge;;;;;;;;;
gui/hud/building_description/blast_furnace;Produces molten metal out of refined ironium;;;;;;;;;
gui/hud/building_description/carbonium_powerplant_renewable;Must be built on top of Carbonium ore deposit. Reagent renders the deposit renewable and does not consume it. Can use only unrefined Carbonium straight from the ground.;;;;;;;;;
gui/hud/building_description/carbonizer;Synthethise carbon from carbon rich gases or liquids;;;;;;;;;
gui/hud/building_description/crystalizer_ferdonite;Crystalizes Ferdonite from Carbonium and Water. Requires carbonium deposit as crystal seed but does not consume the deposit.;;;;;;;;;
gui/hud/building_description/crystalizer_ferdonite_lvl_2;Crystalizes Ferdonite from Carbonium Water and Supercoolant. Requires carbonium deposit as crystal seed but does not consume the deposit.;;;;;;;;;
gui/hud/building_description/crystalizer_ferdonite_lvl_3;Crystalizes Ferdonite from Carbonium Water and Supercoolant. Requires carbonium deposit as crystal seed but does not consume the deposit.;;;;;;;;;
gui/hud/building_description/crystalizer_hazenite;Crystalizes Hazenite from Ironium and Fluorine. Requires ironium deposit as crystal seed but does not consume the deposit.;;;;;;;;;
gui/hud/building_description/crystalizer_hazenite_lvl_2;Crystalizes Hazenite from Ironium Fluorine and Reagent. Requires ironium deposit as crystal seed but does not consume the deposit.;;;;;;;;;
gui/hud/building_description/crystalizer_hazenite_lvl_3;Crystalizes Hazenite from Ironium Fluorine and Reagent. Requires ironium deposit as crystal seed but does not consume the deposit.;;;;;;;;;
gui/hud/building_description/crystalizer_rhodonite;Crystalizes Rhodonite from Ironium and Fluorine. Requires carbonium deposit as crystal seed but does not consume the deposit.;;;;;;;;;
gui/hud/building_description/crystalizer_rhodonite_lvl_2;Crystalizes Rhodonite from Ironium Fluorine and Nitric Acid. Requires carbonium deposit as crystal seed but does not consume the deposit.;;;;;;;;;
gui/hud/building_description/crystalizer_rhodonite_lvl_3;Crystalizes Rhodonite from Ironium Fluorine and Nitric Acid. Requires carbonium deposit as crystal seed but does not consume the deposit.;;;;;;;;;
gui/hud/building_description/crystalizer_tanzanite;Crystalizes Tanzanite from Ammonium and Flammable Gas. Requires ammonium deposit as crystal seed but does not consume the deposit.;;;;;;;;;
gui/hud/building_description/crystalizer_tanzanite_lvl_2;Crystalizes Tanzanite from Ammonium Flammable Gas and Plasma. Requires ammonium deposit as crystal seed but does not consume the deposit.;;;;;;;;;
gui/hud/building_description/crystalizer_tanzanite_lvl_3;Crystalizes Tanzanite from Ammonium Flammable Gas and Plasma. Requires ammonium deposit as crystal seed but does not consume the deposit.;;;;;;;;;
gui/hud/building_description/energy_connector_armored;An armored but more expensive variant of the energy connector;;;;;;;;;
gui/hud/building_description/energy_connector_water;Energy connector on platform that can be placed on liquids pools;;;;;;;;;
gui/hud/building_description/fire_control_station;Powers up/down defense buildings depending on if enemies are in vicinity or not;;;;;;;;;
gui/hud/building_description/fire_control_station_artillery;Powers up/down long range artillery towers depending on if enemies are in vicinity or not. Much wieder detection range then regular fire control stations;;;;;;;;;
gui/hud/building_description/fluorine_trap;Captures atmospheric fluorine compounds from atmosphere;Extrahiert Fluorverbindungen aus der Atmophäre;;;;;;;;
gui/hud/building_description/fluorine_trap_lvl_2;Captures atmospheric fluorine compounds from atmosphere. Improved for fluorine rich enviorments;;;;;;;;;
gui/hud/building_description/fusion_powerplant_lvl_3_new;Very large energy output. Produces plasma resource as a byproduct. REQUIRES magnetic stabilizer for operation;;;;;;;;;
gui/hud/building_description/gas_ionizer;Ionizes input gas into plasma;;;;;;;;;
gui/hud/building_description/heat_charger;Uses extreme ambient heat to ionize air into superchareged plasma;;;;;;;;;
gui/hud/building_description/heavy_water_plant;Seperates heavy water and extracts deuterium from it;;;;;;;;;
gui/hud/building_description/ionizer_lvl_2;Ionizes gas into a hot plasma;;;;;;;;;
gui/hud/building_description/ionizer_lvl_3;Ionizes gas into a hot plasma. Most efficient process uses palladium.;;;;;;;;;
gui/hud/building_description/liquid_material_storage_large;Stores large quantities of liquid materials;;;;;;;;;
gui/hud/building_description/liquid_material_storage_small;Stores liquid materials in a minimal space;;;;;;;;;
gui/hud/building_description/liquid_pumpjack;Pumpjack able to pump liquids from deep wells;Tiefpumpe zur Förderung von unterirdischen Quellen;;;;;;;;
gui/hud/building_description/magnetic_stabilizer;Magnetic Stabilizers that are necessary to open long-range portal in the Rift Station. The Stabilizer negates the irregularities in the electromagnetic field from which also fusion reactors and plasma convertors benefit by an increased +25% yield;;;;;;;;;
gui/hud/building_description/magnetic_stabilizer_alien;A different approach to the problem of stabilizing the Rift Station Portal. Emulating the behavioral properties of magnetic boulders from which also fusion reactors and plasma convertors benefit by an increased +50% yield;;;;;;;;;
gui/hud/building_description/mining_drill;Enables mining underground resource veins. Wastes 50% of ore deposit;;;;;;;;;
gui/hud/building_description/mining_drill_lvl_2;Enables mining underground resource veins. REQUIRES: ore mill to operate. Wastes 25% of ore deposit;;;;;;;;;
gui/hud/building_description/mining_drill_lvl_3;Enables mining underground resource veins. REQUIRES: ore mill to operate. No waste;;;;;;;;;
gui/hud/building_description/moisture_trap;Captures moisture from the air and provides low amount of water;;;;;;;;;
gui/hud/building_description/nitric_acid_refinery;Extracts nitric acid from biomatter;;;;;;;;;
gui/hud/building_description/nitric_acid_refinery_lvl_2;Extracts nitric acid from biomatter;;;;;;;;;
gui/hud/building_description/nitric_acid_refinery_lvl_3;Extracts nitric acid from biomatter;;;;;;;;;
gui/hud/building_description/nitrification_plant;Extracts Nitrates from Animal Biomass;;;;;;;;;
gui/hud/building_description/nitrification_plant_lvl_2;Extracts Nitrates from Animal Biomass;;;;;;;;;
gui/hud/building_description/nitrification_plant_lvl_3;Extracts Nitrates from Animal Biomass;;;;;;;;;
gui/hud/building_description/ore_mill;The ore mill processed mined raw ore into minerals and therefore increasing yield of nearby strip and subsurface mines. Required by higher level mines for operation;;;;;;;;;
gui/hud/building_description/ore_mill_lvl_2;The ore mill processed mined raw ore into minerals and therefore increasing yield of nearby strip and subsurface mines by +50%;;;;;;;;;
gui/hud/building_description/ore_mill_lvl_3;The ore mill processed mined raw ore into minerals and therefore increasing yield of nearby strip and subsurface mines by +85%;;;;;;;;;
gui/hud/building_description/ore_mill_lvl_4;The ore mill processed mined raw ore into minerals and therefore increasing yield of nearby strip and subsurface mines by +125%;;;;;;;;;
gui/hud/building_description/petroleum_refinery;Refines petroleum into reagent and carbonium;;;;;;;;;
gui/hud/building_description/petroleum_refinery_lvl_2;Refines petroleum into reagent and flammable gas;;;;;;;;;
gui/hud/building_description/planet_defense;Expanded planetary scanner with orbital defense laser satelites;;;;;;;;;
gui/hud/building_description/plasma_converter_lvl_3_new;Converts Plasma into Supercharged Plasma by using large amounts of energy. REQUIRES magnetic stabilizer for operation;;;;;;;;;
gui/hud/building_description/plasma_physics;Basics of plasma physics incudes the generation by gas ionization;;;;;;;;;
gui/hud/building_description/plasma_physics_lvl_2;Advanced ionization techniques allow for higher yield generation;;;;;;;;;
gui/hud/building_description/plasma_physics_lvl_3;Further optimization of ionization methods for maximum yield;;;;;;;;;
gui/hud/building_description/reagent_condenser;Condenses hyrdo-fluorines into reagent liquid;Verdichtet Fluorwasserstoffe zur Reagenzlösung;;;;;;;;
gui/hud/building_description/reagent_refinery;produces reagent for chemical processing;;;;;;;;;
gui/hud/building_description/reagent_refinery_lvl_2;produces reagent for chemical processing;;;;;;;;;
gui/hud/building_description/reagent_refinery_lvl_3;produces reagent for chemical processing;;;;;;;;;
gui/hud/building_description/regenerating_extractor;Extracts resources from sourface deposits via special mycelia and use of resin. This is much slower but long term sustainable extraction that does not deplete the deposit.;;;;;;;;;
gui/hud/building_description/repair_central;Repair Central;;;;;;;;;
gui/hud/building_description/resource_converter_cobalt;Uses morphium to convert iron into cobalt;;;;;;;;;
gui/hud/building_description/resource_converter_palladium;Uses morphium to convert cobalt into palladium;;;;;;;;;
gui/hud/building_description/resource_converter_titanium;Uses morphium to convert cobalt into titanium;;;;;;;;;
gui/hud/building_description/rtg;A radioisotope thermoelectric generator is a nuclear energy source that convert radiation heat into electricity;;;;;;;;;
gui/hud/building_description/rtg_lvl_2;A cooled radioisotope thermoelectric generator for inproved yield;;;;;;;;;
gui/hud/building_description/rtg_lvl_3;A cooled radioisotope thermoelectric generator for inproved yield;;;;;;;;;
gui/hud/building_description/solid_material_storage_basic;Storage building for all basic construction and ammunition production materials;;;;;;;;;
gui/hud/building_description/solid_material_storage_other;Storage building for any other solid materials found and harvested on Galatea;;;;;;;;;
gui/hud/building_description/solid_material_storage_rare;Storage building for rare metals;;;;;;;;;
gui/hud/building_description/solid_material_storage_underground;Underground storage facility for all solid materials;;;;;;;;;
gui/hud/building_description/solvent_condenser;Condenses hyrdo-fluorines into solvent liquid;Verdichtet Fluorwasserstoffe zur Solvens-Flüssigkeit;;;;;;;;
gui/hud/building_description/solvent_refinery;produces solvent for resource processing;;;;;;;;;
gui/hud/building_description/solvent_refinery_lvl_2;produces solvent for resource processing;;;;;;;;;
gui/hud/building_description/solvent_refinery_lvl_3;produces solvent for resource processing;;;;;;;;;
gui/hud/building_description/steel_seperator;Seperates simple metals of out lava;;;;;;;;;
gui/hud/building_description/steel_seperator_lvl_2;Seperates metals of out lava including trace amounts of titanium;;;;;;;;;
gui/hud/building_description/steel_seperator_lvl_3;Seperates metals of out lava including low amounts of titanium;;;;;;;;;
gui/hud/building_description/strip_mine;Mines resources from surface outcrops. Wastes 50% of resource deposit;;;;;;;;;
gui/hud/building_description/strip_mine_lvl_2;Mines resources from surface outcrops. REQUIRES: ore mill to operate. Wastes 25% of resource deposit;;;;;;;;;
gui/hud/building_description/strip_mine_lvl_3;Mines resources from surface outcrops. REQUIRES: ore mill to operate. No wasted resources;;;;;;;;;
gui/hud/building_description/supercoolant_chem_plant;Produces coolant from gases;;;;;;;;;
gui/hud/building_description/supercoolant_chem_plant_lvl_2;Production of coolans on ammonium hydrocarbon basis;;;;;;;;;
gui/hud/building_description/supercoolant_chem_plant_lvl_3;Optimized production of coolans on ammonium hydrocarbon basis;;;;;;;;;
gui/hud/building_description/supercoolant_refinery_lvl_2;Refines supercoolant. More productive due to water basis;;;;;;;;;
gui/hud/building_description/supercoolant_refinery_lvl_3;Refines supercoolant. Most productive through titanium infusion;;;;;;;;;
gui/hud/building_description/thermal_ion_charger;Uses extreme heat energy of magma to ionize air into superchareged plasma;;;;;;;;;
gui/hud/building_description/tower_artillery_acid;Artillery using piped resources to prepare rounds with acid payload;;;;;;;;;
gui/hud/building_description/tower_artillery_napalm;Artillery using piped resources to prepare rounds with napalm payload;;;;;;;;;
gui/hud/building_description/tower_artillery_propelled;Artillery using extra propellant to increase firing rage;;;;;;;;;
gui/hud/building_description/tower_artillery_superpropelled;Artillery using extra reagent propellant to maximize firing rage;;;;;;;;;
gui/hud/building_description/tower_cannon;Fires high caliber rounds dealing significant damage per shot;;;;;;;;;
gui/hud/building_description/tower_cannon_acid;Fires high caliber rounds dealing significant damage per shot using piped resources to prepare acid coatied rounds deal damage over time;;;;;;;;;
gui/hud/building_description/tower_cannon_cooled;Fires high caliber rounds dealing significant damage per shot cooled by piped coolant to increase rate of fire;;;;;;;;;
gui/hud/building_description/tower_cannon_cryo;Fires high caliber rounds dealing significant damage per shot using piped resources to prepare cryo infused rounds that slow targets;;;;;;;;;
gui/hud/building_description/tower_cannon_incindiary;Fires high caliber rounds dealing significant damage per shot using piped resources to prepare plasma charged rounds deal fire damage;;;;;;;;;
gui/hud/building_description/tower_cannon_small;Fires 20mm caliber rounds dealing low damage per shot using at a decent rate of fire;;;;;;;;;
gui/hud/building_description/tower_ice_big;Landlocked version of the floating piercer tower. Requires large upkeep of cooling liquid.;;;;;;;;;
gui/hud/building_description/tower_laser_cooled;Laser cooled by piped coolant to increase rate of fire;;;;;;;;;
gui/hud/building_description/tower_laser_supercooled;Laser cooled by piped supercoolant to maximize rate of fire;;;;;;;;;
gui/hud/building_description/tower_laser_water;A floating variant of the laser tower utilizing local fluids for active cooling;;;;;;;;;
gui/hud/building_description/tower_minigun_cooled;Minigun cooled by piped coolant to increase rate of fire;;;;;;;;;
gui/hud/building_description/tower_minigun_frag;Large Minigun using cooling for optimal firepower and fragmentation rounds that hit multiple enemies per shot;;;;;;;;;
gui/hud/building_description/tower_minigun_platform;Minigun on a Platform for defending flooded areas - liquid cooled via enviorment;;;;;;;;;
gui/hud/building_description/tower_minigun_supercooled;Minigun cooled by piped supercoolant to maximize rate of fire;;;;;;;;;
gui/hud/building_description/tower_plasma_base;Plasma cannon uses energy to shoot plasma bolts that incindiate anything they come in contact with;;;;;;;;;
gui/hud/building_description/tower_plasma_charged;Plasma cannon uses using pipes resources to additionally charge the bolts to increase damage;;;;;;;;;
gui/hud/building_description/tower_plasma_supercharged;Plasma cannon uses using pipes resources to super-charge bolts to maximize damage;;;;;;;;;
gui/hud/building_description/tower_railgun_cooled;Railgun using piped coolant for stable operation;;;;;;;;;
gui/hud/building_description/tower_railgun_large;Large Railgun using cooling for optimal firepower;;;;;;;;;
gui/hud/building_description/tower_railgun_supercooled;Railgun using piped supercoolant for miximizing rate of fire;;;;;;;;;
gui/hud/building_description/tower_rockets_propelled;Rocket launcher using extra propellant to increase firing rage;;;;;;;;;
gui/hud/building_description/tower_rockets_superpropelled;Rocket launcher using extra reagent propellant to maximize firing rage;;;;;;;;;
gui/hud/building_description/tower_shockwave_acid;An experimental defensive tower. Pumps acidic substances into the ground surface and uses its mallet to create shock waves releasing the corrosive agents in the ground;;;;;;;;;
gui/hud/building_description/tower_shockwave_area;An experimental defensive tower that does not use any kind of ammunition. Instead - it uses a massive mallet - propelled by electro-plasma thrusters to strike the ground and create a shockwave.;;;;;;;;;
gui/hud/building_description/tower_shockwave_cryo;An experimental defensive tower. Pumps cryogenic substances into the ground surface and uses its mallet to create shock waves activating the cryogenic agents in the ground;;;;;;;;;
gui/hud/building_description/wall_crystal_lvl_1;A defensive wall made from synthesized crystals found in the depths of the Galatean cavern network. When destroyed the wall will shatter and its shards will damage the nearby creatures.;;;;;;;;;
gui/hud/building_description/wall_crystal_lvl_2;Reistant to fire and acid damage but sensible to area damage. Shatters on destruction dealing damage to nearby enemies.;;;;;;;;;
gui/hud/building_description/wall_crystal_lvl_3;Reistant to fire and acid damage but sensible to area damage. Shatters on destruction dealing damage to nearby enemies.;;;;;;;;;
gui/hud/building_description/wall_energy_lvl_1;An advanced form of a wall. Instead of relying on a solid structure this version utilizes high-power laser beams to form a barrier. Coming into contact with this structure may be harmful.;;;;;;;;;
gui/hud/building_description/wall_energy_lvl_2;Advanced powered regenerating energy barrier. Highly resistant to energy and cryo damage but very fragile to physical and sensitve to fire and acid damage. Deals damage on contact.;;;;;;;;;
gui/hud/building_description/wall_energy_lvl_3;Tought powered regenerating energy barrier. Highly resistant to energy and cryo damage but very fragile to physical and sensitve to fire and acid damage. Deals damage on contact.;;;;;;;;;
gui/hud/building_description/wall_small_lvl_1;"Provides basic protection for the base. Can be built in multiple layers. Cheap; reliable and sturdy.";;;;;;;;;
gui/hud/building_description/wall_small_lvl_2;Reinforced conrete wall. Increased physical resistence but fragile to acid and area damage;;;;;;;;;
gui/hud/building_description/wall_small_lvl_3;Tought reinforced conrete wall. High physical resistence but fragile to acid and area damage;;;;;;;;;
gui/hud/building_description/wall_vine_lvl_1;"These walls automatically recede into the ground when the Mech is close to them. This allows the user to shoot over them with ease and negates the need for building gates. Resistant to area and acid damage but very fragile to fire damage. The walls also regenerate missing hit points over time; but do not reconstruct from ruins by themselves.";;;;;;;;;
gui/hud/building_description/wall_vine_lvl_2;Resistant to area and acid damage but very  fragile to fire damage. Regenerates health and recedes when Mech passes by.;;;;;;;;;
gui/hud/building_description/wall_vine_lvl_3;Resistant to area and acid damage but very  fragile to fire damage. Regenerates health and recedes when Mech passes by.;;;;;;;;;
gui/hud/building_description/water_drill;Drills for groundwater;;;;;;;;;
gui/hud/building_name/alloys_factory;Alloys Factory (Cobalt);;;;;;;;;
gui/hud/building_name/alloys_factory_palladium;Alloys Factory (Palladium);;;;;;;;;
gui/hud/building_name/alloys_factory_titanium;Alloys Factory (Titanium);;;;;;;;;
gui/hud/building_name/alloys_factory_uranium;Alloys Factory (Uranium);;;;;;;;;
gui/hud/building_name/ammo_factory_energy_adv;Advanced mech energy ammo processor;;;;;;;;;
gui/hud/building_name/ammo_factory_energy_ext;Top end mech energy ammo processor;;;;;;;;;
gui/hud/building_name/ammo_factory_explosive_adv;Advanced explosives processor;;;;;;;;;
gui/hud/building_name/ammo_factory_explosive_ext;Top end explosives processor;;;;;;;;;
gui/hud/building_name/ammo_factory_explosive_liquid;Explosives and liquid ammo factory;;;;;;;;;
gui/hud/building_name/ammo_factory_highcaliber_adv;Advanced high caliber ammo processor;;;;;;;;;
gui/hud/building_name/ammo_factory_highcaliber_adv_molt;Advanced high caliber ammo factory;;;;;;;;;
gui/hud/building_name/ammo_factory_highcaliber_adv_molt_uranium;Advanced high caliber ammo factory (DU);;;;;;;;;
gui/hud/building_name/ammo_factory_highcaliber_adv_uranium;Advanced high caliber ammo processor (DU);;;;;;;;;
gui/hud/building_name/ammo_factory_highcaliber_adv_uranium_molt;Advanced high caliber ammo factory (DU);;;;;;;;;
gui/hud/building_name/ammo_factory_highcaliber_ext;Top end high caliber ammo processor;;;;;;;;;
gui/hud/building_name/ammo_factory_highcaliber_ext_molt;Top end high caliber ammo forge;;;;;;;;;
gui/hud/building_name/ammo_factory_liquid_adv;Advanced liquid ammo processor (carbonium);;;;;;;;;
